{
  "schemaVersion": 2,
  "kind": "core",
  "id": "semantic-core",
  "version": "2026.08.12.1",
  "dimensions": [
    { "id": "mass", "baseUnitId": "g" },
    { "id": "volume", "baseUnitId": "ml" },
    { "id": "count", "baseUnitId": "piece" },
    { "id": "length", "baseUnitId": "m" },
    { "id": "storage", "baseUnitId": "gb" },
    { "id": "energy", "baseUnitId": "wh" },
    { "id": "power", "baseUnitId": "w" },
    { "id": "voltage", "baseUnitId": "v" },
    { "id": "current", "baseUnitId": "a" },
    { "id": "frequency", "baseUnitId": "hz" },
    { "id": "percentage", "baseUnitId": "percent" }
  ],
  "units": [
    { "id": "g", "capability": "measure", "dimensionId": "mass", "factorToBase": 1 },
    { "id": "kg", "capability": "measure", "dimensionId": "mass", "factorToBase": 1000 },
    { "id": "ml", "capability": "measure", "dimensionId": "volume", "factorToBase": 1 },
    { "id": "l", "capability": "measure", "dimensionId": "volume", "factorToBase": 1000 },
    { "id": "piece", "capability": "both", "dimensionId": "count", "factorToBase": 1 },
    { "id": "dozen", "capability": "both", "dimensionId": "count", "factorToBase": 12 },
    { "id": "pack", "capability": "container" },
    { "id": "packet", "capability": "container" },
    { "id": "bottle", "capability": "container" },
    { "id": "carton", "capability": "container" },
    { "id": "can", "capability": "container" },
    { "id": "box", "capability": "container" },
    { "id": "bag", "capability": "container" },
    { "id": "tray", "capability": "container" },
    { "id": "pouch", "capability": "container" },
    { "id": "jar", "capability": "container" },
    { "id": "tub", "capability": "container" },
    { "id": "roll", "capability": "container" },
    { "id": "loaf", "capability": "container" },
    { "id": "bunch", "capability": "container" },
    { "id": "pair", "capability": "container" },
    { "id": "bar", "capability": "container" },
    { "id": "mg", "capability": "measure", "dimensionId": "mass", "factorToBase": 0.001 },
    { "id": "mcg", "capability": "measure", "dimensionId": "mass", "factorToBase": 0.000001 },
    { "id": "iu", "capability": "measure" },
    { "id": "unit", "capability": "measure" },
    { "id": "meq", "capability": "measure" },
    { "id": "mmol", "capability": "measure" },
    { "id": "m", "capability": "measure", "dimensionId": "length", "factorToBase": 1 },
    { "id": "cm", "capability": "measure", "dimensionId": "length", "factorToBase": 0.01 },
    { "id": "inch", "capability": "measure", "dimensionId": "length", "factorToBase": 0.0254 },
    { "id": "gb", "capability": "measure", "dimensionId": "storage", "factorToBase": 1 },
    { "id": "tb", "capability": "measure", "dimensionId": "storage", "factorToBase": 1024 },
    { "id": "mah", "capability": "measure", "dimensionId": "energy", "factorToBase": 0.001 },
    { "id": "wh", "capability": "measure", "dimensionId": "energy", "factorToBase": 1 },
    { "id": "w", "capability": "measure", "dimensionId": "power", "factorToBase": 1 },
    { "id": "v", "capability": "measure", "dimensionId": "voltage", "factorToBase": 1 },
    { "id": "a", "capability": "measure", "dimensionId": "current", "factorToBase": 1 },
    { "id": "hz", "capability": "measure", "dimensionId": "frequency", "factorToBase": 1 },
    { "id": "percent", "capability": "measure", "dimensionId": "percentage", "factorToBase": 1 },
    { "id": "strip", "capability": "container" },
    { "id": "pint", "capability": "container" },
    { "id": "blister", "capability": "container" },
    { "id": "tablet", "capability": "both", "dimensionId": "count", "factorToBase": 1 },
    { "id": "capsule", "capability": "both", "dimensionId": "count", "factorToBase": 1 },
    { "id": "vial", "capability": "container" },
    { "id": "ampoule", "capability": "container" },
    { "id": "tube", "capability": "container" },
    { "id": "sachet", "capability": "container" },
    { "id": "dose", "capability": "both", "dimensionId": "count", "factorToBase": 1 },
    { "id": "drop", "capability": "both", "dimensionId": "count", "factorToBase": 1 },
    { "id": "puff", "capability": "both", "dimensionId": "count", "factorToBase": 1 },
    { "id": "actuation", "capability": "both", "dimensionId": "count", "factorToBase": 1 },
    { "id": "spray", "capability": "both", "dimensionId": "count", "factorToBase": 1 },
    { "id": "patch", "capability": "both", "dimensionId": "count", "factorToBase": 1 },
    { "id": "lozenge", "capability": "both", "dimensionId": "count", "factorToBase": 1 },
    { "id": "suppository", "capability": "both", "dimensionId": "count", "factorToBase": 1 },
    { "id": "ream", "capability": "container" },
    { "id": "sheet", "capability": "both", "dimensionId": "count", "factorToBase": 1 }
  ],
  "attributes": [
    { "id": "colour", "valueType": "string", "cardinality": "one" },
    { "id": "material", "valueType": "string", "cardinality": "one" },
    { "id": "size", "valueType": "string", "cardinality": "one" },
    { "id": "form", "valueType": "string", "cardinality": "one" },
    { "id": "model", "valueType": "string", "cardinality": "one" },
    { "id": "fat_level", "valueType": "string", "cardinality": "one" },
    { "id": "strength", "valueType": "string", "cardinality": "many" },
    { "id": "compatibility", "valueType": "string", "cardinality": "many" },
    { "id": "waist", "valueType": "string", "cardinality": "one" },
    { "id": "inseam", "valueType": "string", "cardinality": "one" },
    { "id": "footwear_size_system", "valueType": "string", "cardinality": "one" }
  ]
}
